{"$schema":"https://json-schema.org/draft/2020-12/schema","$id":"FbxStagedMapping.v2","title":"FbxStagedMapping.v2","type":"object","additionalProperties":false,"required":["schema","inScopeSourceObjectIds","entries","exclusions"],"properties":{"schema":{"const":"FbxStagedMapping.v2"},"inScopeSourceObjectIds":{"type":"array","items":{"$ref":"#/$defs/sourceId"},"minItems":1,"uniqueItems":true},"entries":{"type":"array","items":{"$ref":"#/$defs/entry"},"minItems":1},"exclusions":{"type":"array","items":{"$ref":"#/$defs/exclusion"}}},"$defs":{"id":{"type":"string","pattern":"^[A-Za-z0-9_.-]+$"},"sourceId":{"type":"string","pattern":"^\\d+$"},"occurrenceId":{"type":"string","pattern":"^occ:\\d+$"},"positive":{"type":"number","exclusiveMinimum":0},"vector3":{"type":"array","items":{"type":"number"},"minItems":3,"maxItems":3},"direction":{"type":"object","additionalProperties":false,"required":["authority","vector"],"properties":{"authority":{"const":"world-vector"},"vector":{"$ref":"#/$defs/vector3"}}},"connection":{"type":"object","additionalProperties":false,"required":["mappingEntryId","portId"],"properties":{"mappingEntryId":{"$ref":"#/$defs/id"},"portId":{"$ref":"#/$defs/id"}}},"portBase":{"type":"object","additionalProperties":false,"required":["portId","role","authority","geometryObjectId","direction","connections"],"properties":{"portId":{"$ref":"#/$defs/id"},"role":{"enum":["A","L","P"]},"authority":{"enum":["mesh-vertex","nurbs-control-point"]},"geometryObjectId":{"$ref":"#/$defs/sourceId"},"vertexIndex":{"type":"integer","minimum":0},"controlPointIndex":{"type":"integer","minimum":0},"direction":{"$ref":"#/$defs/direction"},"connections":{"type":"array","items":{"$ref":"#/$defs/connection"},"maxItems":1}},"oneOf":[{"properties":{"authority":{"const":"mesh-vertex"}},"required":["vertexIndex"],"not":{"required":["controlPointIndex"]}},{"properties":{"authority":{"const":"nurbs-control-point"}},"required":["controlPointIndex"],"not":{"required":["vertexIndex"]}}]},"portA":{"allOf":[{"$ref":"#/$defs/portBase"},{"properties":{"role":{"const":"A"}}}]},"portL":{"allOf":[{"$ref":"#/$defs/portBase"},{"properties":{"role":{"const":"L"}}}]},"portP":{"allOf":[{"$ref":"#/$defs/portBase"},{"properties":{"role":{"const":"P"}}}]},"portsAL":{"type":"object","additionalProperties":false,"required":["A","L"],"properties":{"A":{"$ref":"#/$defs/portA"},"L":{"$ref":"#/$defs/portL"}}},"portsALP":{"type":"object","additionalProperties":false,"required":["A","L","P"],"properties":{"A":{"$ref":"#/$defs/portA"},"L":{"$ref":"#/$defs/portL"},"P":{"$ref":"#/$defs/portP"}}},"pipeEngineering":{"type":"object","additionalProperties":false,"maxProperties":0},"elbowEngineering":{"type":"object","additionalProperties":false,"required":["bendRadiusMm","bendAngleDeg","bendPlaneNormal"],"properties":{"bendRadiusMm":{"$ref":"#/$defs/positive"},"bendAngleDeg":{"type":"number","exclusiveMinimum":0,"maximum":180},"bendPlaneNormal":{"$ref":"#/$defs/direction"}}},"teeEngineering":{"type":"object","additionalProperties":false,"required":["runDiameterMm","branchDiameterMm"],"properties":{"runDiameterMm":{"$ref":"#/$defs/positive"},"branchDiameterMm":{"$ref":"#/$defs/positive"}}},"reducerEngineering":{"type":"object","additionalProperties":false,"required":["largeEndDiameterMm","smallEndDiameterMm","largeEndPortId","smallEndPortId","reducerType"],"properties":{"largeEndDiameterMm":{"$ref":"#/$defs/positive"},"smallEndDiameterMm":{"$ref":"#/$defs/positive"},"largeEndPortId":{"$ref":"#/$defs/id"},"smallEndPortId":{"$ref":"#/$defs/id"},"reducerType":{"enum":["CONCENTRIC","ECCENTRIC"]},"eccentricDirection":{"$ref":"#/$defs/direction"}},"oneOf":[{"properties":{"reducerType":{"const":"CONCENTRIC"}},"not":{"required":["eccentricDirection"]}},{"properties":{"reducerType":{"const":"ECCENTRIC"}},"required":["eccentricDirection"]}]},"flangeEngineering":{"type":"object","additionalProperties":false,"required":["nominalDiameterMm","thicknessMm","flangeType"],"properties":{"nominalDiameterMm":{"$ref":"#/$defs/positive"},"thicknessMm":{"$ref":"#/$defs/positive"},"flangeType":{"type":"string","minLength":1}}},"valveEngineering":{"type":"object","additionalProperties":false,"required":["nominalDiameterMm","faceToFaceMm","valveType"],"properties":{"nominalDiameterMm":{"$ref":"#/$defs/positive"},"faceToFaceMm":{"$ref":"#/$defs/positive"},"valveType":{"type":"string","minLength":1},"operatorDirection":{"$ref":"#/$defs/direction"}}},"entryBase":{"type":"object","additionalProperties":false,"required":["mappingEntryId","logicalComponentId","sourceModelObjectId","sourceOccurrenceId","sourceGeometryObjectIds","componentType","scopeDisposition","ports","engineering"],"properties":{"mappingEntryId":{"$ref":"#/$defs/id"},"logicalComponentId":{"$ref":"#/$defs/id"},"sourceModelObjectId":{"$ref":"#/$defs/sourceId"},"sourceOccurrenceId":{"$ref":"#/$defs/occurrenceId"},"sourceGeometryObjectIds":{"type":"array","items":{"$ref":"#/$defs/sourceId"},"minItems":1,"uniqueItems":true},"componentType":{"enum":["PIPE","ELBOW","TEE","REDUCER","FLANGE","VALVE"]},"scopeDisposition":{"const":"promote"},"ports":{"type":"object"},"engineering":{"type":"object"}}},"entry":{"oneOf":[{"allOf":[{"$ref":"#/$defs/entryBase"},{"properties":{"componentType":{"const":"PIPE"},"ports":{"$ref":"#/$defs/portsAL"},"engineering":{"$ref":"#/$defs/pipeEngineering"}}}]},{"allOf":[{"$ref":"#/$defs/entryBase"},{"properties":{"componentType":{"const":"ELBOW"},"ports":{"$ref":"#/$defs/portsAL"},"engineering":{"$ref":"#/$defs/elbowEngineering"}}}]},{"allOf":[{"$ref":"#/$defs/entryBase"},{"properties":{"componentType":{"const":"TEE"},"ports":{"$ref":"#/$defs/portsALP"},"engineering":{"$ref":"#/$defs/teeEngineering"}}}]},{"allOf":[{"$ref":"#/$defs/entryBase"},{"properties":{"componentType":{"const":"REDUCER"},"ports":{"$ref":"#/$defs/portsAL"},"engineering":{"$ref":"#/$defs/reducerEngineering"}}}]},{"allOf":[{"$ref":"#/$defs/entryBase"},{"properties":{"componentType":{"const":"FLANGE"},"ports":{"$ref":"#/$defs/portsAL"},"engineering":{"$ref":"#/$defs/flangeEngineering"}}}]},{"allOf":[{"$ref":"#/$defs/entryBase"},{"properties":{"componentType":{"const":"VALVE"},"ports":{"$ref":"#/$defs/portsAL"},"engineering":{"$ref":"#/$defs/valveEngineering"}}}]}]},"exclusion":{"type":"object","additionalProperties":false,"required":["sourceModelObjectId","scopeDisposition","reason"],"properties":{"sourceModelObjectId":{"$ref":"#/$defs/sourceId"},"scopeDisposition":{"const":"exclude-with-reason"},"reason":{"type":"string","minLength":1}}}}}
