{"schema":"FbxStagedMapping.v2","inScopeSourceObjectIds":["500","501","502","503","504","505","506","507"],"entries":[{"mappingEntryId":"map-1","logicalComponentId":"PIPE-1","sourceModelObjectId":"500","sourceOccurrenceId":"occ:500","sourceGeometryObjectIds":["600"],"componentType":"PIPE","scopeDisposition":"promote","ports":{"A":{"portId":"A","role":"A","authority":"mesh-vertex","geometryObjectId":"600","vertexIndex":0,"direction":{"authority":"world-vector","vector":[-1,0,0]},"connections":[]},"L":{"portId":"L","role":"L","authority":"mesh-vertex","geometryObjectId":"600","vertexIndex":1,"direction":{"authority":"world-vector","vector":[1,0,0]},"connections":[{"mappingEntryId":"map-2","portId":"A"}]}},"engineering":{}},{"mappingEntryId":"map-2","logicalComponentId":"ELBOW-2","sourceModelObjectId":"501","sourceOccurrenceId":"occ:501","sourceGeometryObjectIds":["601"],"componentType":"ELBOW","scopeDisposition":"promote","ports":{"A":{"portId":"A","role":"A","authority":"mesh-vertex","geometryObjectId":"601","vertexIndex":0,"direction":{"authority":"world-vector","vector":[-1,0,0]},"connections":[{"mappingEntryId":"map-1","portId":"L"}]},"L":{"portId":"L","role":"L","authority":"mesh-vertex","geometryObjectId":"601","vertexIndex":1,"direction":{"authority":"world-vector","vector":[0,-1,0]},"connections":[{"mappingEntryId":"map-3","portId":"A"}]}},"engineering":{"bendRadiusMm":100,"bendAngleDeg":90,"bendPlaneNormal":{"authority":"world-vector","vector":[0,0,1]}}},{"mappingEntryId":"map-3","logicalComponentId":"TEE-3","sourceModelObjectId":"502","sourceOccurrenceId":"occ:502","sourceGeometryObjectIds":["602"],"componentType":"TEE","scopeDisposition":"promote","ports":{"A":{"portId":"A","role":"A","authority":"mesh-vertex","geometryObjectId":"602","vertexIndex":0,"direction":{"authority":"world-vector","vector":[0,1,0]},"connections":[{"mappingEntryId":"map-2","portId":"L"}]},"L":{"portId":"L","role":"L","authority":"mesh-vertex","geometryObjectId":"602","vertexIndex":1,"direction":{"authority":"world-vector","vector":[0,-1,0]},"connections":[{"mappingEntryId":"map-4","portId":"A"}]},"P":{"portId":"P","role":"P","authority":"mesh-vertex","geometryObjectId":"602","vertexIndex":2,"direction":{"authority":"world-vector","vector":[1,0,0]},"connections":[{"mappingEntryId":"map-7","portId":"A"}]}},"engineering":{"runDiameterMm":100,"branchDiameterMm":50}},{"mappingEntryId":"map-4","logicalComponentId":"REDUCER-4","sourceModelObjectId":"503","sourceOccurrenceId":"occ:503","sourceGeometryObjectIds":["603"],"componentType":"REDUCER","scopeDisposition":"promote","ports":{"A":{"portId":"A","role":"A","authority":"mesh-vertex","geometryObjectId":"603","vertexIndex":0,"direction":{"authority":"world-vector","vector":[0,1,0]},"connections":[{"mappingEntryId":"map-3","portId":"L"}]},"L":{"portId":"L","role":"L","authority":"mesh-vertex","geometryObjectId":"603","vertexIndex":1,"direction":{"authority":"world-vector","vector":[0,-1,0]},"connections":[{"mappingEntryId":"map-5","portId":"A"}]}},"engineering":{"largeEndDiameterMm":100,"smallEndDiameterMm":80,"largeEndPortId":"A","smallEndPortId":"L","reducerType":"CONCENTRIC"}},{"mappingEntryId":"map-5","logicalComponentId":"FLANGE-5","sourceModelObjectId":"504","sourceOccurrenceId":"occ:504","sourceGeometryObjectIds":["604"],"componentType":"FLANGE","scopeDisposition":"promote","ports":{"A":{"portId":"A","role":"A","authority":"mesh-vertex","geometryObjectId":"604","vertexIndex":0,"direction":{"authority":"world-vector","vector":[0,1,0]},"connections":[{"mappingEntryId":"map-4","portId":"L"}]},"L":{"portId":"L","role":"L","authority":"mesh-vertex","geometryObjectId":"604","vertexIndex":1,"direction":{"authority":"world-vector","vector":[0,-1,0]},"connections":[{"mappingEntryId":"map-6","portId":"A"}]}},"engineering":{"nominalDiameterMm":80,"thicknessMm":20,"flangeType":"WELD_NECK"}},{"mappingEntryId":"map-6","logicalComponentId":"VALVE-6","sourceModelObjectId":"505","sourceOccurrenceId":"occ:505","sourceGeometryObjectIds":["605"],"componentType":"VALVE","scopeDisposition":"promote","ports":{"A":{"portId":"A","role":"A","authority":"mesh-vertex","geometryObjectId":"605","vertexIndex":0,"direction":{"authority":"world-vector","vector":[0,1,0]},"connections":[{"mappingEntryId":"map-5","portId":"L"}]},"L":{"portId":"L","role":"L","authority":"mesh-vertex","geometryObjectId":"605","vertexIndex":1,"direction":{"authority":"world-vector","vector":[0,-1,0]},"connections":[]}},"engineering":{"nominalDiameterMm":80,"faceToFaceMm":100,"valveType":"GATE"}},{"mappingEntryId":"map-7","logicalComponentId":"PIPE-7","sourceModelObjectId":"506","sourceOccurrenceId":"occ:506","sourceGeometryObjectIds":["606"],"componentType":"PIPE","scopeDisposition":"promote","ports":{"A":{"portId":"A","role":"A","authority":"mesh-vertex","geometryObjectId":"606","vertexIndex":0,"direction":{"authority":"world-vector","vector":[-1,0,0]},"connections":[{"mappingEntryId":"map-3","portId":"P"}]},"L":{"portId":"L","role":"L","authority":"mesh-vertex","geometryObjectId":"606","vertexIndex":1,"direction":{"authority":"world-vector","vector":[1,0,0]},"connections":[]}},"engineering":{}},{"mappingEntryId":"map-8","logicalComponentId":"PIPE-8","sourceModelObjectId":"507","sourceOccurrenceId":"occ:507","sourceGeometryObjectIds":["607"],"componentType":"PIPE","scopeDisposition":"promote","ports":{"A":{"portId":"A","role":"A","authority":"mesh-vertex","geometryObjectId":"607","vertexIndex":0,"direction":{"authority":"world-vector","vector":[0,1,0]},"connections":[]},"L":{"portId":"L","role":"L","authority":"mesh-vertex","geometryObjectId":"607","vertexIndex":1,"direction":{"authority":"world-vector","vector":[0,-1,0]},"connections":[]}},"engineering":{}}],"exclusions":[]}
